{"$schema":"https://json-schema.org/draft/2020-12/schema","type":"object","required":["version","name","source","palette","typography","spacing","layout","radius","themes"],"properties":{"version":{"type":"string"},"name":{"const":"firefly koinon"},"source":{"type":"object","required":["repository","revision","tokensVersion"]},"palette":{"type":"object","additionalProperties":{"type":"string","pattern":"^#[0-9a-fA-F]{6}$"}},"typography":{"type":"object","required":["family","weights"],"properties":{"family":{"const":"Manrope"}}},"spacing":{"type":"object"},"layout":{"type":"object"},"radius":{"type":"object"},"themes":{"type":"object","required":["light","dark"]}}}
