{
  "$schema": "./schema/tokens.schema.json",
  "version": "1.2.0",
  "name": "firefly koinon",
  "source": {
    "repository": "fireflyframework/brand-kit",
    "revision": "b64a50e289b853cab54e5d59bc1b092b48c5eec4",
    "tokensVersion": "1.2.2"
  },
  "palette": {
    "charcoal": "#10110f",
    "paper": "#f3f1eb",
    "amber": "#ffb34a",
    "ink": "#272820",
    "muted": "#62645b",
    "gold": "#855414",
    "stone": "#bfb8ab",
    "line": "#d8d4ca",
    "graphite": "#474a42",
    "white": "#ffffff",
    "steel": "#b4bdb8",
    "slate": "#6b8795",
    "olive": "#7a8460"
  },
  "typography": {
    "family": "Manrope",
    "weights": [
      400,
      500,
      600,
      700
    ],
    "body": "16px / 1.65",
    "label": "13px / 1.4",
    "title": "27px / 1.2",
    "tracking": "-0.035em"
  },
  "spacing": {
    "unit": 4,
    "scale": [
      4,
      8,
      12,
      16,
      24,
      32,
      48,
      64,
      96
    ]
  },
  "layout": {
    "sidebar": 248,
    "sidebarInset": 20,
    "readingMax": 760,
    "contentMax": 1600,
    "gutterDesktop": 32,
    "gutterMobile": 16
  },
  "radius": {
    "control": 8,
    "panel": 12,
    "dialog": 16
  },
  "themes": {
    "light": {
      "surface": "#ffffff",
      "canvas": "#f3f1eb",
      "text": "#272820",
      "muted": "#62645b",
      "line": "#d8d4ca",
      "action": "#ffb34a",
      "actionText": "#10110f"
    },
    "dark": {
      "surface": "#1d1f1a",
      "canvas": "#10110f",
      "text": "#f3f1eb",
      "muted": "#bfb8ab",
      "line": "#474a42",
      "action": "#ffb34a",
      "actionText": "#10110f"
    }
  }
}
